{
  "argv": [
    "scripts/native/build.sh",
    "--profile",
    "w05-asan-nts",
    "--print-binary"
  ],
  "command_id": "build-w05-asan-nts",
  "duration_ms": 120112,
  "environment_profile": "w05-asan-nts",
  "exit_code": 0,
  "format_version": "2.0.0",
  "raw_log": "logs/build-w05-asan-nts.log",
  "raw_log_sha256": "b0b80a7178807d9f0bb3d9998998ecc1857bae734d6ec5cdc387e79d09313bde",
  "raw_log_size_bytes": 1065816,
  "stderr_sha256": "e3b0c44298fc1c149afbf4c8996fb92427ae41e4649b934ca495991b7852b855",
  "stdout_sha256": "b596d3d538cae8b4c5f02139b583beb37d92970e7cc4df976b81bab9f037bcff"
}
