{
  "argv": [
    "scripts/native/test-smoke.sh",
    "--profile",
    "debug-zts"
  ],
  "command_id": "smoke-debug-zts",
  "duration_ms": 66247,
  "environment_profile": "debug-zts",
  "exit_code": 0,
  "format_version": "2.0.0",
  "raw_log": "logs/smoke-debug-zts.log",
  "raw_log_sha256": "6317278fdc642e546b5ef99886dda616101adcf04931c6c6c805335eaa176a0c",
  "raw_log_size_bytes": 949600,
  "stderr_sha256": "e3b0c44298fc1c149afbf4c8996fb92427ae41e4649b934ca495991b7852b855",
  "stdout_sha256": "2ddf984ef1a2a34a1404a2a9144505f5f43daa0f584349b188bf7c242cdfc7ab"
}
