{
  "argv": [
    "python3",
    "scripts/native/control-flow/validate-w04.py",
    "--check"
  ],
  "command_id": "validate-w04",
  "duration_ms": 145,
  "environment_profile": "regression",
  "exit_code": 0,
  "format_version": "2.0.0",
  "raw_log": "logs/validate-w04.log",
  "raw_log_sha256": "8a6f0766f17282959075c1ceaceeb07139a57f82dbdf37a59e86090219b85ec5",
  "raw_log_size_bytes": 106,
  "stderr_sha256": "e3b0c44298fc1c149afbf4c8996fb92427ae41e4649b934ca495991b7852b855",
  "stdout_sha256": "76b6975ebc79fde45cf48d19c1e2c7d2b71a38a5ccd9be47e334f2f34e182425"
}
