{
  "argv": [
    "scripts/native/build.sh",
    "--profile",
    "debug-zts"
  ],
  "command_id": "build-debug-zts",
  "duration_ms": 67610,
  "environment_profile": "debug-zts",
  "exit_code": 0,
  "format_version": "2.0.0",
  "raw_log": "logs/build-debug-zts.log",
  "raw_log_sha256": "b46e0687af4098cd7311ff6e97a28d1d09102bd1aea9bd3b7da4a232742eca55",
  "raw_log_size_bytes": 947663,
  "stderr_sha256": "e3b0c44298fc1c149afbf4c8996fb92427ae41e4649b934ca495991b7852b855",
  "stdout_sha256": "7947e63804911fc03aabf2b99bec778b45077d5e9872afd38bbcc62f50165351"
}
