{
  "argv": [
    "python3",
    "tests/native/calls/fuzz/run_fuzz.py",
    "--seed",
    "20260719",
    "--cases",
    "20000",
    "--candidate-php",
    "${CANDIDATE_PHP}"
  ],
  "command_id": "fuzz-20000",
  "duration_ms": 4301,
  "environment_profile": "w05-debug-nts",
  "exit_code": 0,
  "format_version": "2.0.0",
  "raw_log": "logs/fuzz-20000.log",
  "raw_log_sha256": "185b668c52d9121fa280c25938654efa5af3c188a55312397dabf25525aa0a06",
  "raw_log_size_bytes": 127,
  "stderr_sha256": "e3b0c44298fc1c149afbf4c8996fb92427ae41e4649b934ca495991b7852b855",
  "stdout_sha256": "759342e4aa6f84847ba9792ee8d39db9c550115e6e8d8e205bf962abc76aeed7"
}
