{
  "argv": [
    "python3",
    "-m",
    "unittest",
    "discover",
    "-s",
    "tests/native/waves",
    "-p",
    "test_*.py",
    "-v"
  ],
  "command_id": "waves-unittest",
  "duration_ms": 472,
  "environment_profile": "regression",
  "exit_code": 0,
  "format_version": "2.0.0",
  "raw_log": "logs/waves-unittest.log",
  "raw_log_sha256": "216dfebedac0a04f00fe697e0c20b3d50e7b9d83affde1d0f6203ea3f9300a9d",
  "raw_log_size_bytes": 5825,
  "stderr_sha256": "a125fc279b3d26ae2bca6ae3cdb31f1ab06cb32940dc8337a827a0ceff2d48fd",
  "stdout_sha256": "608718c3e85c55eb457854617aff6f844fc3e4b1a3415fd99a0c872b57997203"
}
