{
  "argv": [
    "scripts/native/test-smoke.sh",
    "--profile",
    "debug-nts"
  ],
  "command_id": "smoke-debug-nts",
  "duration_ms": 71078,
  "environment_profile": "debug-nts",
  "exit_code": 0,
  "format_version": "2.0.0",
  "raw_log": "logs/smoke-debug-nts.log",
  "raw_log_sha256": "9ff7fd81031adcf091e0b26e640f34e0e65bc263299c5f85981d8729ea0a2692",
  "raw_log_size_bytes": 934744,
  "stderr_sha256": "e3b0c44298fc1c149afbf4c8996fb92427ae41e4649b934ca495991b7852b855",
  "stdout_sha256": "5d6e8ad903a3265689209bff60451c9d5939bebcf282614d730e94e81278e952"
}
