{
  "argv": [
    "scripts/native/build.sh",
    "--profile",
    "w05-debug-nts",
    "--print-binary"
  ],
  "command_id": "build-w05-debug-nts",
  "duration_ms": 44282,
  "environment_profile": "w05-debug-nts",
  "exit_code": 0,
  "format_version": "2.0.0",
  "raw_log": "logs/build-w05-debug-nts.log",
  "raw_log_sha256": "ac70f6aaba019ac58ea8cfd10db9bc44dc016eb211a6d0672e1a334ff87eeeeb",
  "raw_log_size_bytes": 1041189,
  "stderr_sha256": "e3b0c44298fc1c149afbf4c8996fb92427ae41e4649b934ca495991b7852b855",
  "stdout_sha256": "2de20d6ffeb6033a08d9fdde53ef9c99bd90b87c8fca1bc7b7b229965a3cd55d"
}
