{
  "argv": [
    "python3",
    "scripts/native/mir/validate-w02.py",
    "--check"
  ],
  "command_id": "validate-w02",
  "duration_ms": 8406,
  "environment_profile": "regression",
  "exit_code": 0,
  "format_version": "2.0.0",
  "raw_log": "logs/validate-w02.log",
  "raw_log_sha256": "e88047eae0278efc1ab352ac99482b82998f3a0d54f20cc406700ddf9fbd40ae",
  "raw_log_size_bytes": 8139,
  "stderr_sha256": "8159f23bf2b64c7655b9845f367345fee67af0d1f0b9b20d5bff883abdc8a795",
  "stdout_sha256": "39e6bb5cfd4d8f8a8f3db1ded7f12111e70ed92a779ac958973308a02cac7358"
}
