{
  "argv": [
    "python3",
    "-m",
    "unittest",
    "discover",
    "-s",
    "tests/native/calls",
    "-p",
    "test_*.py",
    "-v"
  ],
  "command_id": "calls-unittest",
  "duration_ms": 1028,
  "environment_profile": "w05-debug-nts",
  "exit_code": 0,
  "format_version": "2.0.0",
  "raw_log": "logs/calls-unittest.log",
  "raw_log_sha256": "bdca9b65d43b4d9f2e04c64d0e0b5a849dbfa2bd1baac9d03c19fb78dcbae842",
  "raw_log_size_bytes": 6055,
  "stderr_sha256": "bfcf5234118e9c058942dfc8e0b75a4de5e2f8b127ed914f7838eb5d70d5cf0b",
  "stdout_sha256": "e3b0c44298fc1c149afbf4c8996fb92427ae41e4649b934ca495991b7852b855"
}
