{
  "argv": [
    "python3",
    "scripts/native/calls/validate-w05.py",
    "--check"
  ],
  "command_id": "validate-w05",
  "duration_ms": 203,
  "environment_profile": "gate",
  "exit_code": 0,
  "format_version": "2.0.0",
  "raw_log": "logs/validate-w05.log",
  "raw_log_sha256": "e4ced6d6701f13b75d4ac1e428a81ebc9ab7a365b4e916d13d3daf0913efc5d2",
  "raw_log_size_bytes": 84,
  "stderr_sha256": "e3b0c44298fc1c149afbf4c8996fb92427ae41e4649b934ca495991b7852b855",
  "stdout_sha256": "244dfe62613235107c7b4e3917b024ef35ad930a616694c9699d56dfa837af01"
}
