{
  "argv": [
    "python3",
    "scripts/native/semantics/validate-w01.py",
    "--check"
  ],
  "command_id": "validate-w01",
  "duration_ms": 319,
  "environment_profile": "regression",
  "exit_code": 0,
  "format_version": "2.0.0",
  "raw_log": "logs/validate-w01.log",
  "raw_log_sha256": "57eadab3077b2d0b54a6c6ab483316e56192efc1a7641bbaf92c6c5c22a4a4e3",
  "raw_log_size_bytes": 69,
  "stderr_sha256": "e3b0c44298fc1c149afbf4c8996fb92427ae41e4649b934ca495991b7852b855",
  "stdout_sha256": "a2c99af5f1c652581ffb7f6d6502857938d5478a74a4e10c3cb52c34521cbbfe"
}
